<?xml version="1.0" encoding="UTF-8"?>
<xs:schema xmlns:xs="http://www.w3.org/2001/XMLSchema">
  <xs:element name="empresa">
    <xs:complexType>
      <xs:sequence>
        <xs:element name="departamento" maxOccurs="unbounded">
          <xs:complexType>
            <xs:sequence>
              <xs:element name="nombre" type="xs:string"/>
              <xs:element name="empleado" maxOccurs="unbounded">
                <xs:complexType>
                  <xs:sequence>
                    <xs:element name="nombre" type="xs:string"/>
                    <xs:element name="edad" type="xs:positiveInteger"/>
                    <xs:element name="email" type="xs:string"/>
                    <xs:element name="salario">
                      <xs:complexType>
                        <xs:simpleContent>
                          <xs:extension base="xs:decimal">
                            <xs:attribute name="moneda" type="xs:string" use="required"/>
                          </xs:extension>
                        </xs:simpleContent>
                      </xs:complexType>
                    </xs:element>
                  </xs:sequence>
                  <xs:attribute name="id" type="xs:string" use="required"/>
                  <xs:attribute name="tipo">
                    <xs:simpleType>
                      <xs:restriction base="xs:string">
                        <xs:enumeration value="fijo"/>
                        <xs:enumeration value="temporal"/>
                      </xs:restriction>
                    </xs:simpleType>
                  </xs:attribute>
                </xs:complexType>
              </xs:element>
            </xs:sequence>
            <xs:attribute name="id" type="xs:string" use="required"/>
          </xs:complexType>
        </xs:element>
      </xs:sequence>
      <xs:attribute name="nombre" type="xs:string" use="required"/>
      <xs:attribute name="pais" type="xs:string" use="required"/>
    </xs:complexType>
  </xs:element>

</xs:schema>
